链接,面积,房屋户型,楼层,房屋朝向,地铁,小区,位置,时间,租赁方式,付款方式,房屋现状,租赁周期,装修描述,小区介绍,学区介绍,核心卖点,周边配套,交通出行,户型介绍,投资分析
http://gz.lianjia.com/zufang/GZ0002273772.html,60.45平米,2室1厅1卫  整租,中楼层 (共7层),南,暂无数据,邮电宿舍1套出租中,天河华景新城,77天前发布,整租,暂无数据,暂无数据,暂无数据,邮电宿舍家属楼，两房一厅 婚房装修。朝向好，户型方正，方正两房,小区安静优雅干净清爽，环境好，公交4个站就可到达地铁岗顶站，真正地铁物业，让你住的舒适，住的安心，周边配套设施齐全，人文素质高。邮校商圈交界让您的生活更加便捷,,家私家电齐 交通方便 安静舒适,,,正实用三房 过五年，南北对流，阳台望天河公园，一梯二户，南北对流户型，楼梯低层2楼单位，适合居家自住型,
http://gz.lianjia.com/zufang/GZ0002273770.html,206.17平米,4室2厅2卫  整租,低楼层 (共25层),东北,距地铁7号线员岗804米,广州雅居乐花园天域锦园2套出租中,番禺华南,121天前发布,整租,暂无数据,暂无数据,暂无数据,装修好 保养新 看房方便 齐的家私屋电器 厅大房大 视野宽敞,,加拿大国际幼儿园(外教授课)，复旦小学，华师附中，侨联中学(市一级)，碧桂园学校，南村幼儿园(市一级)，南村小学(市一级),天域 高层温馨4房,"绍 省妇幼番禺分院就在广州雅居乐对面.2010年10月开张饮食：湘川土菜馆，会所，酒店，和丰园，我家厨房，周边山庄天然菜色,拉面馆","地铁三号线 七号线 四号线，公交56，17，30，302,小区直通香港巴士",装修好 保养新 看房方便 齐的家私屋电器 厅大房大 视野宽敞,
http://gz.lianjia.com/zufang/GZ0002273799.html,83平米,2室1厅1卫  整租,中楼层 (共6层),东南,暂无数据,金沙湾花园金沙苑1套出租中,番禺沙湾,77天前发布,整租,暂无数据,暂无数据,暂无数据,金沙湾花园 新装修 步梯楼 楼层 步梯楼层3楼 中间位置 之前是出租给人家的 后来业主想自己住 所以才重新粉刷装修,小区内还有游泳池 小型超市 理发店 美容店 幼儿园，篮球场等等,,2房2厅1卫2阳台 家私电器齐全,,金沙湾花园 周边配套成熟方便 ，家门口出去就有公交车站：祈福水城站， 小区自带有街铺，不远处就有菜市场：沙坑市场等等生活配套,,
http://gz.lianjia.com/zufang/GZ0002273889.html,82平米,1室1厅1卫  整租,低楼层 (共29层),南,距地铁3号线华师123米,天立大厦2套出租中,天河龙口东,82天前发布,整租,暂无数据,暂无数据,暂无数据,地板目前是采用办公用的地毯，保养的还是不错的，目前有人在办公，看房还是挺方便的。,小区位于天河北东段与五山路口的交界处，电梯房地理位置优越，24小时严密保安管理，周边配套齐全，配有停车场，休闲广场，等等,幼儿园：天河高新中英文数码幼儿园、启蒙中英文幼儿园、红太阳幼儿园中小学：天河高新中英文数码幼儿园、启蒙中英文幼儿园、龙口西小学、113中学大学：华南师范大学、华南理工大学、暨南大学,距离华师地铁口近 ，交通便利，可租办公,商场：百佳、万佳、苏宁、国美医院：中山三院、天河妇幼保健院、博爱医院邮局：天河北邮局银行：工商银行、农业银行其他：岗顶、总统大酒店小区内部配套：停车场,B17路、B11路、560路、813路、133路、191路、130路、78路、78A路、197路、41路、32路、20路地铁：3号线华师站、3号线岗顶站,,
http://gz.lianjia.com/zufang/GZ0002261285.html,82平米,3室2厅1卫  整租,中楼层 (共12层),北,距地铁2号线东晓南1129米,金碧花园第二金碧45套出租中,海珠金碧,83天前发布,整租,暂无数据,暂无数据,暂无数据,业主原来自住装修保证非常比较好，户型方正通风采光比较好，交通便利,,,三房方正实用 通风采光 交通便利,,东晓南地铁2号线 东晓南步行只需要10分钟   有87.13.86.546.180.202.288.309等各路公交车,三房两厅 该栋苑安静舒适 地理位置 交通便利 周边配套成熟齐全,
http://gz.lianjia.com/zufang/GZ0002261354.html,110平米 (套内96平米),3室2厅2卫  整租,高楼层 (共13层),东南,暂无数据,悦涛雅苑6套出租中,黄埔区府,335天前发布,整租,暂无数据,暂无数据,暂无数据,,"悦涛雅苑，位于丰乐南路28号大院，为黄埔区中间地段电梯楼之一，小区共有9栋高层电梯楼,与3栋楼梯楼组成，小区虽然占地面积不大，但该花园小区设施配套相当的完善、齐。有幼儿园，会所,篮球场，游泳池等等.小区内绿化环境优美，环境安静舒适。",广州市第86中学、中大附属外国语实验中学、怡园东校区。交通便利，,,丰乐肉菜市场，汇润广场，百佳超市，7-11便利店，怡港大厦，黄埔公园,,三房两厅两卫，格局方正实用面积大，居家不拥挤。房大厅大。东偏南向，采光很好的,
http://gz.lianjia.com/zufang/GZ0002261325.html,78.38平米,2室2厅1卫  整租,中楼层 (共33层),西北,距地铁8号线沙园765米,光大花园榕岸4套出租中,海珠工业大道北,83天前发布,整租,暂无数据,暂无数据,暂无数据,保养还不错。雪白的墙身。显示得更加光亮。户型方正。通风采光良好。周边生活气氛良好，人文素质高,采光以及通风都非常好。旺中带静。视野开阔。靓景美不胜收。让您感觉非常舒服。让您心情舒畅。,,交通便利 布局合理,,,属于中型社区，环境优美 ，出入方便 配套成熟。交通方便，附近有多条线路直达广州任何一个区域,
http://gz.lianjia.com/zufang/GZ0002261627.html,56.66平米,2室2厅1卫  整租,中楼层 (共9层),南,暂无数据,汇侨新城南区13套出租中,白云新市,273天前发布,整租,暂无数据,暂无数据,暂无数据,"该房源本人亲自看过,开发商装修,部分家私,格局方正,正南向.",,,"楼梯中层,配套完善",市 场：汇侨新城东区菜市场、大埔菜市场、医 院：汇侨壹心诊所、新市医院、白云区人民医院公 园：白云儿童公园、商 业：澳之星超市、家乐福、沃尔玛,公交站：汇侨新城总站、汇侨南站、新市墟站地铁站：飞翔公园站、白云文化公园,,
http://gz.lianjia.com/zufang/GZ0002273886.html,94平米,3室2厅1卫  整租,高楼层 (共17层),南,暂无数据,金碧世纪花园21套出租中,黄埔区府,205天前发布,整租,暂无数据,暂无数据,暂无数据,保养不错，之前是自住的，业主买的新房子可直接入住. 格局通风明亮,,,正规大三房，格局方正，采光通风好,,"周边公交：途经公交车：B16路, B17路, B20路, B27路, B5路莲溪-公交车站途经公交车：41路夜班, 46路夜班, 550路, B15路, B1快, B1路, B20路, B26路, 夜13路,附近地铁：地铁5号线鱼珠站。",正规大三房，格局方正，采光通风好 客厅高挑 南向两房 随时入住,
http://gz.lianjia.com/zufang/GZ0002261438.html,60平米,2室1厅1卫  整租,高楼层 (共9层),南 北,暂无数据,聚德花园15套出租中,海珠赤岗,86天前发布,整租,暂无数据,暂无数据,暂无数据,"此物业装修保养很好，家私电器齐，墙体地面干干净净,干净舒适！",,,格局方正实用 楼层好 温馨舒适,大塘幼儿园 赤岗小学 赤岗中学 聚德东小学 聚德西小学 聚德中学 广州纺织大学,交通出行 公交]20、69、130、184、190、226、250、464、763、779、高峰快线39、夜45 [地铁]3号线--大塘站/,,
http://gz.lianjia.com/zufang/GZ0002261679.html,88平米,3室2厅1卫  整租,低楼层 (共32层),南,距地铁5号线猎德176米,隽峰苑13套出租中,天河珠江新城中,85天前发布,整租,暂无数据,暂无数据,暂无数据,采用精装修，质感墙纸，靓丽装饰灯，温馨舒适；客厅地面均采用抛光耐磨砖，卧室地面为实木地面板，冬暖夏凉，适宜居家。,小区共分为11栋楼(一期A1~A6座)、(二期A7~A11座)，首层为商铺，物业管理为置佳物业管理公司，品质管理经验丰富；配有地下负三层的停车场。,,南向三房，交通方便,高德置地、春夏秋冬广场、东西塔、广州塔、小蛮腰、兴盛路风情酒吧街、优托邦、肉菜市场、四大银行、健身/游泳/SPA会所等等,地铁5号线猎德站、APM专线花城站、专线公交、地铁5号线猎德站、APM专线花城站、专线公交,,
http://gz.lianjia.com/zufang/GZ0002261605.html,65平米,2室1厅1卫  整租,高楼层 (共9层),南,距地铁6号线横沙271米,金满花园金贵阁1套出租中,白云金沙洲,90天前发布,整租,暂无数据,暂无数据,暂无数据,房屋特有人性化设计，此房子简单的装修风格，白色扇灰墙，客厅房间地板是瓷砖，天花板有壁灯；厨房厕所简朴实用,,,配套成熟 交通方便,佳和购物广场、嘉华超市、金永喜超市、卜蜂莲花，国美电器、苏宁电器、以纯等；工商银行、中国银行、农业银行、农商银行、中国邮政储蓄银行等；金沙洲医院、沙凤卫生门诊部，横沙卫生门诊部。,周边公交：公交：276路、12路、42路、55路、283路、424路、290路、885路、高峰30路、231快线、里07路、佛231路 附近地铁：6号线横沙站,,
http://gz.lianjia.com/zufang/GZ0002261723.html,47平米,1室0厅1卫  整租,中楼层 (共15层),东,距地铁2号线纪念堂598米,颐和雅轩1套出租中,越秀小北,131天前发布,整租,暂无数据,暂无数据,暂无数据,此单位住家装修 保养还不错。雪白的墙身。显示得更加光亮。户型方正。通风采光良好。周边生活气氛良好，人文素质高。,属于中型社区，环境优美 ，出入方便 配套成熟。成熟地段，交通方便，附近有多条线路直达广州任何一个区域。,,交通便利 配套完善 户型方正,,,,布局合理。采光以及通风都非常好。旺中带静。视野开阔。靓景美不胜收。让您感觉非常舒服。让您心情舒畅。
http://gz.lianjia.com/zufang/GZ0002261760.html,80.6平米,3室2厅1卫  整租,中楼层 (共6层),北,暂无数据,祈福新村康怡居7套出租中,番禺祈福,92天前发布,整租,暂无数据,暂无数据,暂无数据,装修：业主原为自住，两年前重新装修过，住了一年左右就出国移民，保养好，拎包马上入住。,,,保养靓，家电齐全，,3.位置：毗邻大夫山旁，周边绿化110%。小区花园位置，望祈福全景，前后楼距宽阔，周边百步可达(公交车站，商业街，超级菜市场，15万人流,,⒈房型：此户型非常实用，南北对流，带大阳台，春凉夏爽。(注：房产证面积不添加阳台面积。),
http://gz.lianjia.com/zufang/GZ0002261774.html,118.89平米,4室2厅2卫  整租,中楼层 (共21层),南,暂无数据,喜洋居4套出租中,天河华景新城,83天前发布,整租,暂无数据,暂无数据,暂无数据,装修好，布置温馨，厅房保养都非常好，拎包即可入住，整体搭配非常好，给人一种清新感觉,小区位于天河公园北门口，小区不大但是什么都齐有花园，有活动场所等门口就是brt站交通异常便利，现在小区附近正在修建地铁口,,方正实用，安静舒适，交通便利,肯德基，华润万家，百佳，工商银行，建设银行等还有南方三院等等。,,,
http://gz.lianjia.com/zufang/GZ0002261901.html,85平米,3室1厅1卫  整租,中楼层 (共8层),南,暂无数据,汇怡苑丽怡居1套出租中,白云同德围,84天前发布,整租,暂无数据,暂无数据,暂无数据,此套间住家装修，间隔方正，厅出阳台，一进大门就是大厅，南向，住家装修，通风采光好,汇怡苑(一至二期)位于同德围，该小区是成熟小区，交通方便，生活便利，小区环境优美，适合居住，此小区房屋年代：1999年建造，物业费：0.40元/平方米/月，环境整洁干净，各类生活配套服务设施齐,,家私家电齐 通风采光好,,周边公交：175 176 17 212 215 228 238 524 527 545 832,,
http://gz.lianjia.com/zufang/GZ0002261864.html,54平米,1室1厅1卫  整租,中楼层 (共31层),东,暂无数据,保利大都汇36套出租中,番禺华南,83天前发布,整租,暂无数据,暂无数据,暂无数据,业主新装修，简约时尚风格，一房一厅，有独立厨房和阳台，房子新净，直接入住,"大型绿化小区，环境好啊，24小时保安管理，生活配套设施齐,楼距间隔高",,家电齐 高层视野开阔 随时入住,,,一厅一房一卫生间一厨房，家电家具在，多种绿色植物，纯天然的氧吧，让您的生活更加健康！采光通风,
http://gz.lianjia.com/zufang/GZ0002261994.html,93平米,3室2厅2卫  整租,高楼层 (共18层),北,暂无数据,碧桂园凤凰城凤馨苑27套出租中,增城新塘,83天前发布,整租,暂无数据,暂无数据,暂无数据,业主自己装修 保养好 光线充足 三房带主套 现租客在住 约看房,,,精装修三房带主套 光线充足,有市场，有楼巴，小学，幼儿园，里面有各种商店。要什么有什么，非常方便，是你不二之选，对面有一大广场，银行，大型超市，电影院都有,位于广园东路，107国道旁，属于碧桂园凤凰城的小区，共有16条街，属于大型小区，里面的环境清静，绿化好，治安好，小区出入都需要登记。周围的配套好，有自已的交通枢纽和公车站，有多路公车去广州，东莞，步行5分钟范围内围的配套好.,,
http://gz.lianjia.com/zufang/GZ0002262000.html,79平米,1室1厅1卫  整租,低楼层 (共16层),东,距地铁5号线潭村469米,凯旋新世界枫丹丽舍8套出租中,天河珠江新城东,83天前发布,整租,暂无数据,暂无数据,暂无数据,欧式风格，生活舒适安静！采光好，尽览小区花园。生活高质量健康之选。珠江新城尊贵高境界之选。,凯旋新世界位居天河珠江新城，城市新中轴线上。项目南望珠江，北依28万平方米的珠江公园，东邻广州赛马场，西为即将建设的市民广场和海心沙观光公园；东接直达深圳与珠江三角洲的华南快速干线，西北面驳广州大道与黄埔大道，地理位置可以方便连接内环路及城市快速干线。,幼儿园：春田花花幼儿园、南国幼儿园、海滨幼儿园、广州空军司令部幼儿园、华南师范附属幼儿园中小学：猎德小学、华师附属南国实验中学、华师附属南国实验学,保养好 户型方正,,,,
http://gz.lianjia.com/zufang/GZ0002262054.html,55平米,2室2厅1卫  整租,高楼层 (共31层),东南,距地铁3号线岗顶557米,枫丹雅筑5套出租中,天河龙口西,88天前发布,整租,暂无数据,暂无数据,暂无数据,正宗大两房，装修精美，住家装修，保养较好，环境安静，房子干净舒适。家私电器齐，可拎包入住，,,,交通方便 住家装修 小区管理,周边有中国银行，中国工商银行，天河少年宫，沃尔玛超市，百佳超市，华润万家超市。,附近有龙口西站公交车站，出门龙口西路可达天河北路，交通方便，附近有岗顶地铁站，岗顶brt站。,,
http://gz.lianjia.com/zufang/GZ0002262056.html,50平米,1室1厅1卫  整租,低楼层 (共9层),北,距地铁2号线东晓南939米,南洲花苑C区3套出租中,海珠金碧,83天前发布,整租,暂无数据,暂无数据,暂无数据,南洲花苑本房源装修情况 还是以前的装修户型没有改过还是以前交楼标准 无论大厅还是房间都实用很高,南洲花苑位于南洲路与广州大道南交界，相临海珠客运站，交通极为便利，多班公交线路来往市区，,,南洲花苑 环境舒适 户型方正 望景花园,南洲肉菜市场，华南鞋城，好又多超市，华润万家超市，地铁，多路公交，各菜系饮食餐厅，,地铁2号线东晓南，公交546，263，247，960，836，239，276，779等多路公交,,
http://gz.lianjia.com/zufang/GZ0002258454.html,30平米,1室1厅1卫  整租,高楼层 (共5层),南,距地铁1号线东山口524米,中山二路庙前直街3套出租中,越秀东山口,85天前发布,整租,暂无数据,暂无数据,暂无数据,原住家普通装修，标准一房一厅，保养较为良好。楼梯中层 通风采光好，间隔合理实用,,幼儿园：育才第二幼儿园、执信南幼儿园 中小学：执信中学、育才中学、东风东路小学、执信南路小学、农林下路小学 大学：广东工业大学、广州铁路职业技术学院执信南校,近地铁 近学校 环境安静,幼儿园：育才第二幼儿园、执信南幼儿园 中小学：执信中学、育才中学、东风东路小学、执信南路小学、农林下路小学 大学：广东工业大学、广州铁路职业技术学院执信南校,该物业近地铁一号线东山口站，步行五分钟即达公交车总站；另步行五分钟到东山口站有多条公交站线路。方便去到城市各处,,
http://gz.lianjia.com/zufang/GZ0002258447.html,50平米,2室1厅1卫  整租,高楼层 (共9层),南,距地铁6号线东湖982米,东华南路4套出租中,越秀东川路,256天前发布,整租,暂无数据,暂无数据,暂无数据,经过本人实地勘察 该房源装修保养比较好 瓷砖地板 采光通风好 白色灰墙,,,采光通风好 方正实用 家电齐,东华南路周边有东华南市场 东湖新村市场 东湖公园 大沙头小学 中华广场 烈士陵园,东华南路150号位于越秀区 交通便利 楼下就是公交车站 地铁六号线东湖站只需7分钟路程,,
http://gz.lianjia.com/zufang/GZ0002269795.html,130平米,3室2厅2卫  整租,低楼层 (共30层),东南,距地铁1号线体育西路549米,富力盈力大厦8套出租中,天河珠江新城西,87天前发布,整租,暂无数据,暂无数据,暂无数据,"商住两用 可注册公司,保养新净，安静舒适，朝向特好，大飘台，光线充足，景观好",购物中心超市，菜市，酒店，咖啡馆，中式、西式、港式餐厅，饭馆，寿司店，会所，健身房，泳池，银行，学校，医院，花城广场，广州图书馆，广州大剧院，广东省博物馆，海心沙，广州塔,,"商住两用，可注册,安静舒适 光线充足",史丹尼周边配套完善，交通便利。是珠江新城写字楼中，比较经济实惠的,3、5号线双线地铁，地铁珠江新城站和五羊新城站，走路到史丹尼大概10分钟左右。,,
http://gz.lianjia.com/zufang/GZ0002258456.html,87平米,3室2厅1卫  整租,高楼层 (共9层),南 北,距地铁1号线陈家祠412米,幸福新村4套出租中,荔湾荔湾路,88天前发布,整租,暂无数据,暂无数据,暂无数据,房屋内带有住家装修，总体保养得比较新净，里面干净整洁、部分家私电器都比较完善，可以拎包入住的,,周边学校有:龙津小学 西华路小学 乐贤坊小学 荔湾区少年宫 西关外国语小学 玛利亚 比诺中英文以及西关幼儿园等等,幸福新村 三房一厅 分家电齐全 南北对流,家乐福超市，万佳百货，国美电器，新光城市广场，新大新百货；医院：荔湾区中医院;银行：中国银行，工商银行。,,,
http://gz.lianjia.com/zufang/GZ0002269790.html,69平米,5室2厅2卫  整租,低楼层 (共32层),南,暂无数据,金碧世纪花园21套出租中,黄埔区府,111天前发布,整租,暂无数据,暂无数据,暂无数据,户型方正 保养很好，装修靓丽，家私电器齐，采光好 可拎包入住,金碧世纪花园座落于天河中山大道与黄圃交界处，BRT莲溪旁。交通四通八达，路段。小区有浓厚的住家气氛，环境优美，绿化面积广。幼儿园，超市，美容院，菜市场等等一应都有，足不出户便可享受生活,,南北对流 采光通透 家电齐,"周边公交：途经公交车：B16路, B17路, B20路, B27路, B5路莲溪-公交车站途经公交车：41路夜班, 46路夜班, 550路, B15路, B1快, B1路, B20路, B26路, 夜13路,附近地铁：地铁5号线鱼珠站。",,,
http://gz.lianjia.com/zufang/GZ0002258551.html,90平米,3室1厅1卫  整租,高楼层 (共17层),东南,暂无数据,保利公园九里3套出租中,荔湾龙溪,86天前发布,整租,暂无数据,暂无数据,暂无数据,全屋精装修，1房1厅1卫1厨1阳台，设计时尚，房大厅大，通风采光好。,保利公园九里 位于荔湾区龙溪中路，占地11万平米，总建筑面积约40万平米。 项目北临花地河畔，自然景观优势突出，社区还配备了双园林、双泳池、双会所，每栋楼的楼间距均保持在80米以上，目前各项规划配套正在逐步落实，利好消息频出。,,全新入住，电楼高层，带精装修，环境舒适,项目配套休闲娱乐：葵蓬生态园 医院：综合性三甲医院广州中医药大学第三附属医院、广州市第一人民医院，并且有妇幼保健专科二甲医院广州市荔湾区妇幼保健院购物：4万㎡的邦华商业配套,交通状况：(1)公交车站：增南路口站，公交207线、838.966线途经；(2)地铁站：地铁一号线坑口站、广佛线菊树站，10分钟路程(3)地铁接驳巴：周六日、节假日，地铁一号线坑口站A出口；,,
http://gz.lianjia.com/zufang/GZ0002269827.html,89平米 (套内71平米),3室2厅1卫  整租,低楼层 (共34层),北,距地铁6号线如意坊774米,万科柏悦湾4套出租中,荔湾大坦沙,82天前发布,整租,暂无数据,暂无数据,暂无数据,万科柏悦湾 户型方正，家电齐 业主爱惜房子 保养新净 无明显污迹与渗漏 可直接入住,,中小学：双桥小学，河沙小学，沙面小学分校幼儿园，广雅幼儿园，河沙幼儿园。,业主保养良好 可以拎包入住,华润万家，乐家购物商场，日新百货商场，美景百货商场，柏康药店，佳选百货，裕富多平价商场，佳又多好超市。,,,
http://gz.lianjia.com/zufang/GZ0002269743.html,42.86平米,1室1厅1卫  整租,中楼层 (共5层),南,距地铁1号线陈家祠686米,荔湾路5套出租中,荔湾陈家祠,102天前发布,整租,暂无数据,暂无数据,暂无数据,"业主简易装修,居家两房 舒适温馨 格局方正通风采光好 交通便利 地铁沿线 生活配套成熟",,,居家两房近地铁 家私家电齐 实用舒适,附近有荔湾体育馆，荔湾区青少年宫，广州医科大学荔湾医院，陈家祠旅游景点，新光百货等大开型商场广场,公交：133.196.268.413.705.高峰37.高峰61.夜95。步行10分钟左右到陈家祠地铁站,,
http://gz.lianjia.com/zufang/GZ0002269771.html,155平米,3室2厅2卫  整租,低楼层 (共22层),北,距地铁5号线潭村602米,凯旋新世界枫丹丽舍8套出租中,天河珠江新城东,141天前发布,整租,暂无数据,暂无数据,暂无数据,珠江新城低密度社区，格局方正，装修保养好，干净整洁；房大厅大，通风舒适。,"凯旋新世界位于天河珠江新城,城市新中轴线上,西为即将建设的市民广场和海心沙观光公园;东接直达深圳与珠江三角洲的华南快速干线,西北面驳广州大道与黄埔大道。",,格局方正，通风舒适，装修保养良好,周边配套 肉菜市场、超市、各类餐饮食肆、公交、银行、学校、医院等,地铁：五号线潭村站/猎德站。公交：珠江新城总站和临江大道东站,,
http://gz.lianjia.com/zufang/GZ0002269855.html,105.34平米,4室2厅2卫  整租,高楼层 (共8层),南,距地铁6号线天平架462米,侨乐新村1套出租中,天河沙太南,95天前发布,整租,暂无数据,暂无数据,暂无数据,房子装修壕华，四房两厅两个卫生间，家私电器齐。地板是瓷砖地板，墙壁是用乳白色油漆刷的，实用面积大，楼梯好走。,小区周围配套齐，旁边就是幼儿园，出了小区就是侨乐小学。很大的小区，治安管理舒心,,装修好好！~南北对流 交通便利 离学校近,,"小区门口步行200米左右可到侨乐新村公交站，途经的公交车有：136,502,808,201等，步行300米左右即是地铁六号线天平架地铁站。","房子是四房两厅两卫，进门是一个饭厅之后是客厅，厅出阳台，有两个卫生间,厅出阳台，南北对流,户型格局好。",
http://gz.lianjia.com/zufang/GZ0002269929.html,141平米,2室2厅1卫  整租,低楼层 (共15层),南 北,暂无数据,花都银燕大厦1套出租中,花都旧区,290天前发布,整租,暂无数据,暂无数据,暂无数据,子是电梯北向中层物业，房子格局方正，客厅非常大气，另外房子业主重新，格局方正 拎包即可入住.,空中花园 地铁沿线 交通方便 娱乐配套齐 花果山 人民广场 人民公园等等,,近五小 近花果山公园 近市场,,,,
