链接,面积,房屋户型,楼层,房屋朝向,地铁,小区,位置,时间,租赁方式,付款方式,房屋现状,租赁周期,装修描述,小区介绍,学区介绍,核心卖点,周边配套,交通出行,户型介绍,投资分析
http://gz.lianjia.com/zufang/GZ0002243280.html,67.9平米,2室2厅1卫  整租,中楼层 (共9层),南 北,暂无数据,金宇花园3套出租中,荔湾东塱,93天前发布,整租,暂无数据,暂无数据,暂无数据,装修较新保养好，免去二次装修，可马上入住，采光明亮。中层实用两房,金宇花园位于东沙大道侧边，东沙生活区内。由几十栋9层高楼梯楼组成，区内有东沙小学、幼儿园、大型超市、肯德基、肉菜市场等配套，十分完善。,该单位位于东沙大道，小区整体规模大，所以小区里面自带，幼儿园，小学，幼儿园是东沙幼儿园，小学是东沙小学,金宇花园 间隔方正 保养好 交通方便,,地理位置得天独厚，私家车和公交车都方便出行，小区北门有公交车总站，有52、277、64、121、780、769、417等公交线路,,
http://gz.lianjia.com/zufang/GZ0002243321.html,79平米,1室1厅1卫  整租,低楼层 (共16层),北,距地铁5号线潭村839米,凯旋新世界枫丹丽舍8套出租中,天河珠江新城东,101天前发布,整租,暂无数据,暂无数据,暂无数据,该单位为装修，保养好，房间地板为木地板，浴室是带有纹路的大理石。,,幼 儿 园： 春田花花幼儿园、南国幼儿园、海滨幼儿园、广州空军司令部幼儿园、华南师范附属幼儿园中 小 学： 猎德小学、华师附属南国实验中学、华师附属南国实验学、天河实验小学、天河中学、先烈东小学、体育东小学大 学： 暨南大学、华南理工大学、华南师范大学、中山大学,珠江新城 花园小区 户型方正,"综合商超： 宏城超市新兴分店医 院： 华侨医院、广州市眼科医院邮 局：工商银行、民生银行、交通银行、中国银行、农业银行、光大银行、招商银行、广州农商银行、中信银行、浦发银行、建设银行、湛江银行、华夏银行、邮政银行其 它： 游泳池,　阅览室,　餐厅,　羽毛球场,　",,,
http://gz.lianjia.com/zufang/GZ0002243542.html,95平米,3室1厅1卫  整租,中楼层 (共9层),东,距地铁5号线小北148米,环市中路1套出租中,越秀小北,230天前发布,整租,暂无数据,暂无数据,暂无数据,1.简单装修 格局方正2.墙壁新装修 无发黑发霉现象3.厕所无漏水 无滴水现象 采光良好 瓷砖地板,,,大三房 交通便利 通风良好 环境优雅,越秀公园，雕塑公园，鹿湖公园 周边有医院，幼儿园 小学 中学 大学 餐饮 酒店 ，中山纪念堂，省府，市委，省级小北路小学，市2中学，第17中学，周边有十几家银行，餐饮，大型超市，酒店，公园等等,越秀公园公交车站，电视塔公交站 越秀公园地铁站，小北公交站，小北花圈公交站，小北地铁站 广州汽车站 省汽车站 火车站,,
http://gz.lianjia.com/zufang/GZ0002243433.html,99平米,3室2厅1卫  整租,高楼层 (共30层),东,距地铁8号线沙园193米,中海橡园国际6套出租中,海珠工业大道北,94天前发布,整租,暂无数据,暂无数据,暂无数据,此单位重新装修过。保养非常不错，雪白的墙身。显示得更加光亮。户型方正。通风采光良好。周边生活气氛良好，人文素质高,,,西南朝向 配套完善 户型方正,学校：北大附中(民办)、宝玉直小学、41中学、江南中学等市场：榕景路肉菜市场、沙园市场、梅园市场、厚德市场等医院：旧区里配有卫生院、广州市红会医院、珠江医院等饮食：小区外围多家大小餐厅饭馆如：太平沙、广钢早餐、红帆酒店等,公交：光大花园总站 243、813、123、地铁2号线接驳车、248等凤凰新村、沙园站 31、9、79、811、10、16等多条线路地铁：地铁8号线沙园站和凤凰新村站。广佛线,布局合理。采光以及通风都非常好。旺中带静。视野开阔。靓景美不胜收。让您感觉非常舒服。让您心情舒畅。,
http://gz.lianjia.com/zufang/GZ0002243385.html,81平米,2室2厅1卫  整租,中楼层 (共33层),东南,距地铁5号线大沙东882米,金碧领秀国际17套出租中,黄埔区府,95天前发布,整租,暂无数据,暂无数据,暂无数据,房子是精装修东南向的两房，家私家电是今年8月份刚配的全新家电家私，中高楼层，通风采光好，适宜居家,,,BRT乌冲站 门口小学幼儿园,购物：苏宁电器、百佳超级市场、大沙综合批发市场、惠润广场、乐润超市、丰乐批发市场、摩登百货等医疗：中山大学一院黄埔院区、港湾医院； 休闲：大沙地商业街、山水时尚酒店,周边公交：BRT乌冲站(B1路、B27路、B17路等)周边地铁：地铁5号线(大沙东站)，地铁13号线即将开通。,,
http://gz.lianjia.com/zufang/GZ0002243497.html,50平米,2室1厅2卫  整租,低楼层 (共7层),南,距地铁2号线洛溪239米,吉祥北园吉祥南二街2套出租中,番禺洛溪,93天前发布,整租,暂无数据,暂无数据,暂无数据,新装修 新家具 地铁口隔壁 交通方便 带大花园 干净敞亮 采光和通风好 小区成熟配套,,,新装修 新家具 干净两房 带大花园,商场：百佳超市、华润万家超市 医院：大石医院、广州紫荆医院、社区医院 邮局：洛溪邮局 银行：中国银行、工商银行、广发银行、农业银行、农商银行、邮政银行 其他：海鲜烧烤食街、洛溪新城市场、洛溪食街 小区内部配套：停车场、儿童游乐场,,公交：129路53路、146路、769路、番17、番13、79路、125路、211路、301路、308路、522路、562路、822路、地铁接驳4号、地铁接驳5号。地铁：2号线洛溪站、2号线南浦站、地铁3号线夏窖站,
http://gz.lianjia.com/zufang/GZ0002243268.html,73平米,2室2厅1卫  整租,低楼层 (共32层),北,距地铁5号线猎德180米,隽峰苑13套出租中,天河珠江新城中,100天前发布,整租,暂无数据,暂无数据,暂无数据,屋内精装修 通风光线好 宽敞舒适 家私电器齐 看房方便 随时入住,香港上市公司路劲地产开发精品小区，物业采取轮班管理，偌大的小区花园，院庭惬意生活，可随时随地尊享小区配套，地下停车位充足，让小区兼具舒适与私密性，给您好住户体验。,,精装修 地铁就在楼下 生活配套完善,花城汇广场、高德置地春夏秋冬广场、珠江道商业广场、迪卡龙运动超市、美西超市、肉菜市场、兴盛汇风情酒吧街、健身会所等等。,"小区距离地铁五号线猎德站近,金穗路有多路公交车线,交通便利.",,
http://gz.lianjia.com/zufang/GZ0002243335.html,123平米 (套内113平米),4室2厅2卫  整租,高楼层 (共9层),东,距地铁5号线大沙东721米,怡港花园怡丰楼2套出租中,黄埔区府,111天前发布,整租,暂无数据,暂无数据,暂无数据,配套家电完善，装修保养良好，但采光通风好，交通也方便，合租的也可以,怡港花园位于黄埔区黄埔东路188号大院，小区大门步行1分钟即到BRT下沙站，过了BRT天桥便是黄埔区医院，与黄埔公园仅一路之隔，东门过去就是黄埔的高端商业广场惠润广场，小区内与旁边怡港大厦提供车位数量可观，生活和交通非常方便,,家电配套 拎包入住 近未来地铁第13号线,医院：中山大学一院黄埔院区； 银行：工商银行、建设银行、农业银行、深发展银行、中国银行、中国民生银行； 饮食：头啖汤、客家王、麦当劳参厅、真功夫餐厅、黄埔花园酒家、黄埔酒店、广州酒家； 娱乐：黄埔区青少年宫、黄埔公园、 黄埔体育馆；,交通便利，为你的出行省时省力。门口就有下沙BRT公交车站，走路到5号线大沙地站大概10分钟。,,
http://gz.lianjia.com/zufang/GZ0002243382.html,67平米,2室1厅1卫  整租,高楼层 (共9层),东南,暂无数据,佳地新都4套出租中,白云新市,170天前发布,整租,暂无数据,暂无数据,暂无数据,据业主描述普通装修，家私电器都有，8成新。采光很好，隔局实用,这个小区是楼梯楼，小区由两栋楼八个梯口组成，总层高是九楼，小区中间还带有小区自己小区的花园，还有自带小区的娱乐场所等设施。,,采光好 间隔实用,,公车路经小区门口，807总站也很近，只要步行1分钟即可到过。步行十分钟到新市墟更多公车选择，市场、步街、超市等都在楼盘的附近，公立幼儿园等。,,
http://gz.lianjia.com/zufang/GZ0002243593.html,80平米,2室1厅1卫  整租,低楼层 (共21层),南,距地铁8号线赤岗883米,利海假日轩1套出租中,海珠赤岗,94天前发布,整租,暂无数据,暂无数据,暂无数据,利海假日轩，开发商装修，电梯两房，装修新净，保养好，家私家电齐，房间是木地板装修，低层，厅出阳台。,利海假日轩，位于海珠区赤岗东路华怡花园内。通过小区道路的合理组织，休闲设施的精心安排，提供自然、舒适的居住环境。社区主流健康向上，社区风气良好，邻里关系和谐。项目以实用、舒适、分区合理为整体规划原则。,赤岗八号线赤岗站，公交车站赤岗路口，多路线经过{B7、37、93、206、229、253、239、262、270,利海假日轩 进地铁 随时看房入住,"利海假日轩该物业医院;广东省第二人民医院,四而一医院,超市.好又多,百佳,华润万家,庆龙超市",,,
http://gz.lianjia.com/zufang/GZ0002243570.html,95平米,3室2厅1卫  整租,高楼层 (共33层),南,暂无数据,时代倾城2套出租中,番禺华南,137天前发布,整租,暂无数据,暂无数据,暂无数据,发商原装修，业主没住过，屋内干净整洁新，直接拎包入住即可。正南向 户型靓 采光好,小区高，空气清新，环境优美舒适，楼距宽，近七星岗公园，环境优美，是番禺区中休闲住,,楼层好  配套成熟,时代倾城环境医疗：社区医院、南村医院、省妇幼保健院，七星岗休闲误乐：露天泳池、室内恒温泳池、网球场、羽毛球场、蓝球场、足球场,,,
http://gz.lianjia.com/zufang/GZ0002243193.html,113平米,3室2厅1卫  整租,高楼层 (共9层),东,暂无数据,下塘西路5套出租中,越秀麓景,191天前发布,整租,暂无数据,暂无数据,暂无数据,精装修 简单家私电器 有钥匙方便看房 周边配套齐 步行十分钟可到小北地铁站,,,靠近地铁 配套齐 出行方便 环境优美,,"地铁五号线小北站，多条公交车线路 124路,886A路,46路,244路,271A路,245路,241路,752路,741路环线,旅游公交1线地  铁： 5号线,2号线,1号线",三房 一个大房，次卧加一个小书房 位置好 出行方便 四通八达 环境优美 空气清新 采光好,
http://gz.lianjia.com/zufang/GZ0002243623.html,176平米,4室2厅1卫  整租,低楼层 (共29层),东南,距地铁5号线员村904米,海景花园2套出租中,天河天河公园,101天前发布,整租,暂无数据,暂无数据,暂无数据,物业为精装修，家电齐，装修保养很好！即可拎包入住，干净整洁该物业是176方的三房带主套 东北向望公园 视野开阔通风 景观极好 明户型,海景花园座落广州新城，天河区地段(紧接天河公园，北靠中山大道、南临黄埔干线，西接珠江新城，东落天河软件园)!成为CBD之上的醇美公园大宅，将借势地铁和金融城的利好，打造更便捷、更繁华的生活。住进海景花园，紧握城宁静，举步即达公园与地铁及国际金融城。,,小区花园优质大四居，望天河公景观好,商场：家乐福，国华侨医院、中山医科大学附属第三医院等；银行：农业银行、建设银行、中国银行、工商银行、招商银行、中信银行,,,
http://gz.lianjia.com/zufang/GZ0002243606.html,70平米,2室2厅1卫  整租,低楼层 (共9层),南,暂无数据,佳润上品菁园3套出租中,天河东圃,97天前发布,整租,暂无数据,暂无数据,暂无数据,房子装修很好，客厅是用瓷砖，房间时用木地板，卫生间厨房都是用好的材料，大门用的材料也是比较好。,小区位于中山大道黄村BRT站羊城花园后面，是新楼盘来的，管理都是很完善的。,,装修保养好，交通便利,周边交通是比较方便的，广州BRT公交车站黄村站5分钟到，有多条公交车路线，B2A B3 B5 B17 B16等多条公交车，离地铁口三溪站10分钟。,,,
http://gz.lianjia.com/zufang/GZ0002243679.html,55平米,3室1厅1卫  整租,高楼层 (共7层),东,距地铁6号线文化公园585米,十八甫北路1套出租中,荔湾西关,275天前发布,整租,暂无数据,暂无数据,暂无数据,房子是简单装修，地板都是瓷砖设计，窗户都是铁窗，房间门都是木门，厨房和卫生间墙身都采用瓷砖设计。,,,实用高 3房租低 地铁方便,华林玉器街，上下九步行街，十八甫路菜市场，文化公园，十三行服装批发，文化公园。,地铁6号线文化公园站，康王南路公交站，德星路总站，多条公交线路，交通方便。,,
http://gz.lianjia.com/zufang/GZ0002243659.html,123平米,3室2厅2卫  整租,中楼层 (共31层),西南,距地铁5号线潭村823米,珠江太阳城广场裕富2套出租中,天河珠江新城东,122天前发布,整租,暂无数据,暂无数据,暂无数据,欧式 装修，保养好，通风性和采光性都非常好，布局非常合理，没有浪费面积，中高层安静舒适，景观视野佳。,珠江太阳城广场”位于珠江新城东部，马场路以东，赛马场以西，北靠富力科讯大厦、联通新时空大厦、暨南大学，南依酒店和珠江公园，地铁五号线赛马场站在咫尺之遥。珠江太阳城广场由2座高端公寓和珠江新城内型的商业组成,,通风性 采光佳 舒适住家,,周边公交：公交：194路、272路、522A路、522路、138路地铁：5号线潭村站附近地铁,,
http://gz.lianjia.com/zufang/GZ0002243633.html,108平米,3室2厅2卫  整租,高楼层 (共32层),南,暂无数据,金碧世纪花园21套出租中,黄埔区府,93天前发布,整租,暂无数据,暂无数据,暂无数据,装修保养新净，一直是业主自住，交易成功后无需装修即可拎包入住，免去装修带来的时间等待。,金碧世纪花园座落于天河中山大道与黄圃交界处，BRT莲溪。交通四通八达，好路段。小区有浓厚的住家气氛，环境优美，绿化面积广。,幼儿园：恒威实验幼儿园中小学： 广州市123中、广州市18中、广州市88中、广州市第三小学、恒威实验小学大学：华南师范大学、暨南大学。,新装修 入住免装,商场：东圃购物、金碧社区医院、长泰医院、黄村公立医院、黄浦区医院邮局：羊城花园邮政所、：农业银行、浦发银行其他：珠村市场、盈珠市场小区内部配套：游泳池、会所、餐厅、羽毛球场、足球场、篮球场、网球场、洗衣店、停车场、儿童游乐场。,公交：B1路、B5快线、B5路、B16路、B17路、B24路、B26路、B27路、夜41路、夜46路。 地铁：5号线三溪站、5号线鱼珠站。,,
http://gz.lianjia.com/zufang/GZ0002243640.html,48平米,1室0厅0卫  整租,高楼层 (共22层),东,距地铁3号线汉溪长隆93米,奥园城市天地58套出租中,番禺华南,95天前发布,整租,暂无数据,暂无数据,暂无数据,新装修复式1房实用80多方，中楼层，中空客厅大气，业主是按商住两用装修，家私电可以按租客要求来配，，,位于番禺华南新城的核心商圈长隆汉溪-万博板块，地处广州新城市中轴线(天河城——珠江新城—番禺新城)，将建成集酒店、写字楼、商场、文化娱乐于一体的商业，，,,享华南商圈 配套成熟 即租即入住,城市天地广场五、七号地块商铺及公寓于2014年工程竣工、2015年竣工。项目的成功开发所带来的“都市娱乐旅游效应”，必将影响珠三角乃至中国，使之成为广州现代的标志性建筑，成为市民和旅游宾客观光、休闲的之地，，,,复式2房，精装修，商住两用，可以注册公司，新卖家私电器，精修温磬，拎包入住，，,项目地块位于汉溪长隆站侧，城际轨道换行枢纽；项目周边交通路网发达，经新光快速、华南快速、市广路、番禺大道15分即可快速抵达广州天河、海珠及番禺，，
http://gz.lianjia.com/zufang/GZ0002243685.html,82平米 (套内60平米),1室1厅1卫  整租,高楼层 (共42层),南,距地铁apm线妇儿中心404米,领峰园14套出租中,天河珠江新城中,124天前发布,整租,暂无数据,暂无数据,暂无数据,领峰酒店式公寓，82方奢华一房一厅单位，房屋配置进口家电，西式开发式厨房，大衣帽间、大浴缸。居住人群质素高，多为商务人士，年轻人居住。,领峰W是酒店式公寓，但产权是70年住宅性质的，而且是带有天河区省级体育东小学和天河中学的房，这里的公寓是按W酒店装修标准，配备家私电器，拎包即可入住。公寓采用酒店式管理，每月有4次免费情节服务，前台免费帮忙收发快递，24h物业管理服务,,精致装修 家私家电配套完善,,领峰位于珠江新城核心位置，是个复合型的商住项目，分为领峰住宅、广州W酒店、服务式公寓。地段优越，与众多写字楼东塔、高德置地、恒大等仅一路之隔，也是广州CBD区内商业步行街的龙头位置,领峰酒店式公寓，82方奢华一房一，房屋配置进口家电，西式开发式厨房，大衣帽间、大浴缸。居住人群质素高，多为商务人士，年轻人居住,
http://gz.lianjia.com/zufang/GZ0002243680.html,83平米,2室1厅1卫  整租,高楼层 (共18层),南,距地铁2号线江南西769米,南康阁2套出租中,海珠江南西,93天前发布,整租,暂无数据,暂无数据,暂无数据,此单位住家装修 保养还不错。雪白的墙身。显示得更加光亮。户型方正。通风采光良好。,属于中小型社区，出入方便 配套成熟。地段好，交通方便，附近有多条线路直达广州任何一个区域.,,交通便利 配套完善,,,布局合理。采光以及通风都非常好。旺中带静。视野开阔。靓景美不胜收。让您感觉非常舒服。让您心情舒畅。,
http://gz.lianjia.com/zufang/GZ0002243716.html,91平米,3室1厅1卫  整租,中楼层 (共9层),东,暂无数据,宏航苑翠云阁3套出租中,白云新市,126天前发布,整租,暂无数据,暂无数据,暂无数据,,,,,周边配套齐全，新市中学，新市医院，等等。银行，商场，菜市场应有仅有餐饮一条街 等,,房子是三房两厅一卫双阳台，客厅和一个房间朝东，另外两个朝西，其中一个有阳台。前后没有楼遮挡。,
http://gz.lianjia.com/zufang/GZ0002243707.html,100平米,3室1厅1卫  整租,高楼层 (共8层),南,距地铁3号线大石1045米,富丽家园1套出租中,番禺大石,186天前发布,整租,暂无数据,暂无数据,暂无数据,格局方正，房子装修很不错，墙壁业主装修过的，房间和我卫生间采用的现代装修，每一个房子的装修都具有独特性，厨房和灶台装修很好，使我们年轻人喜欢的风格。,,,近地铁站 交通便利 小区环境好 居家,大石城，步行街，大石家私城，民润超市，信和超市，天和百货，人人乐等多个大型超市。 附近[医院]：大石镇人民医院，武警医院,"地铁3号线,地铁2号线、1、7、13、17、51、211、247、288、301、305、308、309、512、530、562等等。",,
http://gz.lianjia.com/zufang/GZ0002243807.html,62平米 (套内62平米),2室1厅1卫  整租,中楼层 (共9层),南,暂无数据,泽德花园10套出租中,白云同德围,96天前发布,整租,暂无数据,暂无数据,暂无数据,"里面装修很好,家私家电基本齐，采光好、2房一厅，干净舒适，中高层单位，住家装修",,,中高层单位，住家装修 复式单位。,"泽德花园周边配套：中国银行,工商银行,白云区中医院,酒楼,骏荣广场食街,同德上步广场,家私城,菜市场~~~龙涛小学,泽德中学,明德小学,富康市场,天记酒楼,新景酒家,215总站,富康羽毛球场,富贵旅馆,泽德幼儿园,横窖菜市,场泽德中医院。","泽德花园小区交通情况：交通情况：西槎路215/17/545/524/527/539/832/134/179/176/175/196/241/527/539/524/212/238/228/241/夜15/夜21/夜2 等等同德围站:,424,832,215,7,63等",,
http://gz.lianjia.com/zufang/GZ0002243826.html,50平米,2室1厅1卫  整租,低楼层 (共10层),北,暂无数据,敏捷伊顿公馆13套出租中,番禺祈福,127天前发布,整租,暂无数据,暂无数据,暂无数据,"复式LOFT公寓 做了上下两层两房两厅设计 可做办公或者住家,可配齐家私电器",,广东工业大学、广东书法学院、广东文艺职业技术学院、大罗小学、祈福精英幼儿园、祈福英语实验幼儿园、祈福新邨幼儿园、番禺机关幼儿园、祈福英语实验学校、祈福新邨学校、钟村学校,复式 实用率 商住两用,,金山谷花园站，公交线路有1、13、15、91、96、97、98、99、108、301、309等,"复式项目，4.5米复式公寓,做了上下两层两房两厅设计,可做办公或住家",
http://gz.lianjia.com/zufang/GZ0002243825.html,83平米,3室2厅1卫  整租,低楼层 (共6层),东北,距地铁广佛线燕岗992米,保利花园镜湖东街2套出租中,海珠工业大道中,95天前发布,整租,暂无数据,暂无数据,暂无数据,此单位装修保养好，间隔方正，采光好好，通风好，墙壁整体光洁明亮，实用三房，电梯中层，望园林景，位置优越。,保利花园是2000年度国家小康住宅示范小区，由实力雄厚的保利集团南方公司开发。户型设计方正简约实用，小区环境优美，面对工业大道同类楼盘的竞争，开发商力求尽善尽美，从而奠定其在海珠区乃至广州大盘的地位，空间有非常大,,此单位间隔方正，采光好好，通风好,医院：广州医学院第二附属医院、口腔医院、珠江医院、石溪中医院、江南外科医院市场：华润万家超市、百佳超市、保利红棉市场、石溪肉菜市场银行：中国银行、工商银行、建设银行 农业银行 交通银行 等等,"公交车站(南石头)：79路, 288a路, 309路, 469路, 521路, 527路 180路 31路 29路 220路 221路 583路 78路 79路 9路 544路 963路, 546路, 551路, 583路, 964路,24路, 夜3路",布局合理。采光以及通风都非常好。旺中带静。视野开阔。靓景美不胜收。让您感觉非常舒服。让您心情舒畅。,
http://gz.lianjia.com/zufang/GZ0002243708.html,94平米,2室1厅0卫  整租,高楼层 (共19层),南,距地铁7号线南村万博938米,海印又一城海印星玥6套出租中,番禺华南,92天前发布,整租,暂无数据,暂无数据,暂无数据,精装修 采光通风都很好，实用率高， 朝向靓，空气好，小区管理，安全舒适,"购物健身娱乐.托儿所.儿童乐园等,还有大型地下停车场,以人车人流的设计理念,即宁静又安全",,"交通方便,小区管理 采光通风好 全新装修",,公交车：五洲装饰材料城站，途径路线包括公交地铁接驳专线4、17路[P]、129A、129路、303A、303路、304路、657路、洛溪新城-南沙港线(终点站是旧南沙港)。地铁;地铁3号线夏滘站,,
http://gz.lianjia.com/zufang/GZ0002243865.html,61平米,1室1厅1卫  整租,低楼层 (共32层),北,距地铁3号线北延段林和西474米,中怡城市花园27套出租中,天河天河北,96天前发布,整租,暂无数据,暂无数据,暂无数据,这是中怡城市花园小区里面的大2房，现在改成了1房加1衣帽间。时尚装修，保养好，厅出阳台，采光通风好。,中怡城花园位于天河北路中信旁，步行广州火车东站十分钟路程，中怡城市花园占地面积:22261平方米，建筑面积130000平方米。户型间隔3房2厅到1室都有选择，户型面积从38135平方米等。雄踞天河北的中怡城市花园，楼盘外观高雅，设计独特，深受到不少中外人士青睐。,,园林小区 安静舒适 地段好 户型方正,周边还有小学、中学、幼儿园、菜市场、超市、银行、酒楼等等24小时便利店等生活设备,交通极为方便，地铁一号线和三号线上盖，火车东站公交车总站，组成优越的交通网络,户型方正，厅出阳台，两房现改成一个大房，时尚装修，保养好，厅出阳台，采光通风好，安静舒适。,
