链接,面积,房屋户型,楼层,房屋朝向,地铁,小区,位置,时间,租赁方式,付款方式,房屋现状,租赁周期,装修描述,小区介绍,学区介绍,核心卖点,周边配套,交通出行,户型介绍,投资分析
http://gz.lianjia.com/zufang/GZ0002406087.html,163平米,4室2厅2卫  整租,高楼层 (共19层),南,距地铁4号线车陂南798米,骏景花园南苑骏御轩3套出租中,天河棠下,3天前发布,整租,暂无数据,暂无数据,暂无数据,南苑南向4房户型 可以租办公 安静望花园采光好 视野好 4个房间都可以住人 三房朝南,骏景花园精英之城从98年2月开始动工，是广州市采用南北走向的平衡式布局的大规模，大空间，大园林的大社区，楼与楼之间最宽距离达到48米，底层是新加坡式的架空结构，风车型的设计让骏景花园通风采光好，而且各种生活配套经过10多年的发展，现已成熟。,大学：华南师范大学、暨南大学、华南理工大学、华南农业大学中小学：骏景小学、骏景中学、泰安中学、泰安小学、新元小学、培育小学幼儿园：骏景幼儿园、春江幼儿园、美好幼儿园、培育幼儿园,南向 厅大房大阳台大 4房 安静望花园,商场：中英超级广场、好又多、卜蜂莲花、屈臣氏、家乐福、百安居、宏城超市、骏景超市邮局：天朗邮政局、东圃邮政局银行：建设银行、农业银行,交BRT棠东站：B1路、B2路、B2A路、B3路、B4路、B4A路、B5路、B6路、B7路、B22路地铁：4号线车陂站、地铁5号线车陂南站、科韵路站,,
http://gz.lianjia.com/zufang/GZ0002406048.html,89平米,2室2厅1卫  整租,高楼层 (共32层),南,距地铁2号线东晓南872米,金碧花园第三金碧68套出租中,海珠金碧,1天前发布,整租,暂无数据,暂无数据,暂无数据,本人亲自看过 简单装修 干净整洁 卫生间干湿分离，拎包入住 室内居家精装修，保养干净舒适，客厅装饰显得房子特温馨，采光通风好,"恒大地产开发的，物业为金碧物业，楼间距较大的大型楼盘。社区里面的生活配套很完善，1.小区楼龄(2003年),目前已有12年楼龄2.金碧花园一期属于大型高层住宅小区，小区环境优美，娱乐设施配套完善",,大两房 采光充足 交通方便,银行，力美健健身房 。餐饮娱乐如金碧大世界，ktv， 肯德基，小区门口150米处就是加油站,,,
http://gz.lianjia.com/zufang/GZ0002406049.html,72.23平米,2室1厅1卫  整租,高楼层 (共18层),西,距地铁2号线东晓南1038米,金碧花园第二金碧45套出租中,海珠金碧,1天前发布,整租,暂无数据,暂无数据,暂无数据,装修保养好 精装修采光充足，居家之选户型方正，采光通风都很好布局合理。,户型方正，采光通风都很好布局合理。采光以及通风都非常好。旺中带静。视野开阔。靓景美不胜收。让您感觉非常舒服。让您心情舒畅,,业主诚心放租 温馨两房 南北对流,,,户型方正，采光通风都很好布局合理。采光以及通风都非常好。旺中带静。视野开阔。靓景美不胜收。让您感觉非常舒服。让您心情舒畅,户型方正，采光通风都很好布局合理。采光以及通风都非常好。旺中带静。视野开阔。靓景美不胜收。让您感觉非常舒服。让您心情舒畅
http://gz.lianjia.com/zufang/GZ0002405986.html,82平米,2室2厅1卫  整租,高楼层 (共18层),北,距地铁5号线科韵路1066米,粤和楼1套出租中,天河天河公园,82天前发布,整租,暂无数据,暂无数据,暂无数据,该物业目前空置 普通住家装修 实用通透 安静望公园 视野开阔通风,粤和楼是在黄埔大道中天河公园东门的位置 环境非常好 靠软件园 生活氛围极好 交通也很方便,,安静 公园洋房,,,该物业是82方的电梯两房 房间一间朝南 一间朝北 望公园 环境极好 高层视野开阔,
http://gz.lianjia.com/zufang/GZ0002405971.html,94平米 (套内80平米),3室1厅1卫  整租,中楼层 (共12层),南 北,距地铁4号线车陂229米,美好居12套出租中,天河车陂,30天前发布,整租,暂无数据,暂无数据,暂无数据,房子是大两房，目前是业主自住状态，装修保养豪华，位置安静，正南向，采光通透。住家之选，拎包入住。,小区管理好 物业尽责，采光温馨 居住非常好 很多周边工作的人都是比较好的选择。,,小区环境优美，邻近地铁，交通便利,周边配套多， 学校 商业街 医院都有 楼盘周围建金融城 四号线地铁车陂站。BRT车陂站,,,
http://gz.lianjia.com/zufang/GZ0001801033.html,119平米,3室0厅1卫  整租,高楼层 (共9层),东 西,暂无数据,华景新城建宇轩3套出租中,天河华景新城,232天前发布,整租,暂无数据,暂无数据,暂无数据,"采光通风好，总体来说装修保养较好，三房,精装修,环境安静,家电家私配齐",小区多半是二房或大三房，由69-120方不等，有独立的管理，虽然没有小区环境，西向的房就会有点吵，其它的就不会吵，但与华景新城共享生活配套，交通也方便，所以住家，这栋楼是不错的选择,,华景新城建宇轩 大单间 家私家电齐,十五年成熟生活配套 双公交总站 各大银行 饭店 菜市场 超市 便利店 水果 店 花店进口美食店 美容修身连锁店 健身会所 服装店 学校 教育机构等完善配套,华景新城小区内设有双公交总站 560 298 191 130 239 293 194 B9 公交线路.华景新城BRT.,,
http://gz.lianjia.com/zufang/GZ0001990251.html,58平米,1室1厅1卫  整租,高楼层 (共9层),西北,暂无数据,芳村大道西10套出租中,荔湾滘口,164天前发布,整租,暂无数据,暂无数据,暂无数据,此套物业为空房出租，厅直阳台阳台，西向，一般家住装修，无家私电器，楼下就是公交车站，出行便利，安逸生活,,,房间及客厅够大 总价合理 可接受合租,医院：中山医附属芳村人民医院、福康医院 银行：工商银行、建设银行、中国银行、农业银行、广州银行、光大银行其他：桥东市场,公交：19路、高峰快线22路、52路、55路、57路、75路、81路、123A路、193路、202路、206路、207路、佛山277路、277路、281路、309路、411路、783路地铁：5号线滘口站,,
http://gz.lianjia.com/zufang/GZ0002002779.html,31平米 (套内23平米),1室0厅1卫  整租,低楼层 (共18层),东,暂无数据,易丰大厦5套出租中,天河天河公园,154天前发布,整租,暂无数据,暂无数据,暂无数据,房子户型方正，少有东向户型、带阳台，安静舒适，房子装修漂亮、保养好,,,东向带阳台 干净整洁 家私家电齐,学校：幼儿园、天府路小学、113中学、暨南大学等交通：公交华侨医院站(30多条路线)、地铁5号线(潭村站)超市：家乐福超市、百佳、菜肉市场等医院：华侨医院,"243 路:美林花园-革新路总站06:00-22:30, 途经国防大厦/天河立交/中山医等；245 路:广州科学城-黄石路06:00-22:30, 途经东圃镇/国防大厦等；261 路:渔珠-中山八路总站06:00-21:30, 途经黄埔大道东圃/中山纪念堂等",,
http://gz.lianjia.com/zufang/GZ0001933561.html,135平米,3室2厅1卫  整租,中楼层 (共13层),南,距地铁4号线车陂南652米,骏景花园南苑骏灏轩3套出租中,天河棠下,188天前发布,整租,暂无数据,暂无数据,暂无数据,新业主放盘，户型好，厅出阳台，位置安静，视野开阔，南向望金融城，目前把房间打通了，适合办公,建有入口广场、广场和八个各具特色的主题园林。小区环境宁静优美，并建有幼儿园与中学、医疗保健，设施齐的会所、菜市场、银行、超市、居委会等生活设施，的保安系统以及港式的物业管理，设有广州市二十四服务的业主尊贵服务,,南向3房 通风采光好业主诚心放租,,公交车站：棠东站、棠下站(BRT)途经线路:518路，地铁站：5号线科韵路站、5号线和4号线交汇站点车陂南站和4号线车陂站接驳,,
http://gz.lianjia.com/zufang/GZ0002042073.html,108平米,3室2厅2卫  整租,高楼层 (共32层),西南,距地铁8号线凤凰新村576米,金碧湾4套出租中,海珠工业大道北,149天前发布,整租,暂无数据,暂无数据,暂无数据,保持发展商装修 抛光地砖 粉刷白墙 房间统一实木地板 卫生间白色马桶！,小区的园林特点以叠级式水系为主，借鉴巴厘岛水景，通过丰富的植被、原石、连廊、天桥连接贯穿，平台花园与首层水系形成立体园林，首层为架空水景园林，并设计有大面积的空中花园。,,配套成熟 间隔实用 配套齐,,边交通:9、10、59、79、114、125、183、220、226、239、75、243、251、288、16、31、B21、811、813、地铁8号线与广佛地铁线等,,
http://gz.lianjia.com/zufang/GZ0002166394.html,101平米,3室2厅2卫  整租,低楼层 (共13层),南 北,距地铁5号线科韵路647米,骏景花园南苑骏扬轩5套出租中,天河棠下,142天前发布,整租,暂无数据,暂无数据,暂无数据,"业主自住,家电家私齐.房子户型方正，进门通风，装修保养也很好，很适合居家常住，业主很爱干净，,拎包入住",,,"家电家私齐,保养好,拎包入住",医院配套：骏景花园社区医疗服务站、南方医科大学附属医院、中山三院菜市场：骏景花园北苑菜市场、骏景南苑菜市场、棠东牌坊菜市场五大银行: 中行 农行 工行 建行 招商银行.,公交BRT棠东站：B1路、B2路、B3路、B4路、B5路、B6路、B7路、B22路地铁：4号线车陂站,"103，朝向：南北通透向,户型方正通透，视野开阔，采光佳,，装修不错，",
http://gz.lianjia.com/zufang/GZ0002159665.html,105平米,4室2厅2卫  整租,中楼层 (共6层),西,距地铁2号线东晓南936米,鸣翠花园5套出租中,海珠工业大道南,114天前发布,整租,暂无数据,暂无数据,暂无数据,精装修， 实用4房， 装修保养好， 干净整洁， 安静望花园， 中楼层,鸣翠花园小区封闭式管理，小区共分四期开发，楼下就是广佛线的石溪站，交通便利,,近地铁 安静舒适 居家,商场]：华润万家、好又多、百佳、国美、女人街商业城4、[银行]：工商、建设、中国、农业、交通银行5、[医院]：中山二院南院、石溪中医院、紫荆医院6、[其他]：麦当劳，肯德基，江南菜馆，鸿星酒家，天宝酒家，鸣翠邮局,"9、13、59、75、79、86、87、180、202、221、230、288,9、13、59、75、79、86、8546、551、 夜7、夜20、夜24(金碧花园站)地铁二号线东晓南站与八号广佛延长线即将开通。",,
http://gz.lianjia.com/zufang/GZ0002045392.html,38平米,1室1厅1卫  整租,高楼层 (共9层),西,距地铁广佛线燕岗710米,保利红棉花园6套出租中,海珠江燕路,148天前发布,整租,暂无数据,暂无数据,暂无数据,装修保养新净 格局方方正正 宽敞明亮 采光极好 厅出阳台 视野好,保利红棉花园位于广州市海珠区江燕路353号，为大型商住小区，占地面积6.8万平方米，总建筑面积24.8万平方米 小区配套：花园 幼儿园 小学 肉菜市场 商业街 食街 电信 邮局 会所 小亭 娱乐健身场地等硬件设施。小区管理 环境清幽舒适 空气清新怡人,,新净实用 交通便利 光线充足,医院：广州医学院第二附属医院、口腔医院、珠江医院、石溪中医院、江南外科医院。 市场：华润万家超市、百佳超市、保利红棉市场、石溪肉菜市场。 银行：中国银行、工商银行、建设银行 农业银行 交通银行 等等,,,
http://gz.lianjia.com/zufang/GZ0002108410.html,76平米,3室2厅1卫  整租,高楼层 (共9层),南,距地铁2号线萧岗1167米,祥华阁2套出租中,白云黄石路,128天前发布,整租,暂无数据,暂无数据,暂无数据,房屋属于精致装修  房屋的装修保养都很好 温馨舒适 朝向好 格局反正,空气清新，环境优美，价格适中。祥景体育公园，占地3万平方米、将绿化、运动、休闲集为一体、为祥景花园的绿色健康生活提供了有力保障。祥景花园有着优质的物业管理，制定了严格的绿化管理制度和清洁卫生管理制度。舒适怡人的绿化、卫生环境，荣获“示范小区”的光荣称号。,,房屋干净整洁 温馨三房家私齐 即可入住,,公车：265、810、36、244、21、127、268、886、291、126、803、832等多路公交车地铁：二号线 江夏站、萧岗站交通方便快捷 为您保证出行无忧,,
http://gz.lianjia.com/zufang/GZ0002172114.html,42平米,1室1厅1卫  整租,高楼层 (共32层),南,距地铁3号线汉溪长隆482米,保利大都汇36套出租中,番禺华南,172天前发布,整租,暂无数据,暂无数据,暂无数据,业主交楼首 次出租，装修标准，品味高 端舒适生活，就从这里开始 干净整洁 目前吉屋 可配家私电 也可直接用做办公用地,周 边有汉溪长隆地铁、公交车站、汉溪长隆游玩场所小区。港润购物广场、人人乐购物广场、百佳、番禺天河城折扣店 (居家购物方便至极)2、 位于小区不 远有周 边银行：农业银行、工商银行、中国银行(投 资理财方便快捷),广东工业大学番禺学校 钟村实验学校 北京师范大学南奥实验学校 南奥实验小学 南奥实验幼儿园,地铁 上盖 交楼装修 随时看房,新一佳购物广场、广汇百货、十八哥超市、华润万家超市、宏城超市、沃尔玛山姆会员店餐饮：长隆欢乐世界、香江野生动物世界、长隆水上乐园、长龙高尔夫、万博商业中 心、御水泉国际水疗会周 边银行：工商银行、建设银行、浦发银行、农业银行,地铁三号线汉溪长隆站 广州南站 番禺大道 市广路 兴业大道 兴南大道 金山大道 新光快速干线 迎宾路 地铁七号线 汉溪大道,,
http://gz.lianjia.com/zufang/GZ0002176802.html,97平米,3室2厅2卫  整租,高楼层 (共34层),东北,距地铁6号线如意坊820米,万科柏悦湾4套出租中,荔湾大坦沙,109天前发布,整租,暂无数据,暂无数据,暂无数据,开发商统一装修，精致装修，业主爱惜房子，保养良好。无明显污渍与渗漏,华润万家，乐家购物商场，日新百货商场，美景百货商场，柏康药店，佳选百货，裕富多平价商场，佳又多好超市,双桥小学，河沙小学，沙面小学分校幼儿园，广雅幼儿园，河沙幼儿园,万科柏悦湾 方正高层,,,开发商统一装修，精致装修，业主爱惜房子，保养良好。无明显污渍与渗漏,
http://gz.lianjia.com/zufang/GZ0002171998.html,61平米,2室2厅2卫  整租,低楼层 (共22层),北,暂无数据,保利大都汇36套出租中,番禺华南,129天前发布,整租,暂无数据,暂无数据,暂无数据,优势一：地理位置好，位于中 心位置，不靠马路近地铁！优势二：通风采光好,,香江学校第一幼儿园、大石镇河村幼儿园、星河湾灵格风幼儿园 中小学：华南师范大学附属中学番禺学校、里仁洞小学、番禺执信中学、北京师苑大学南奥实验学校(私立)幼儿园小学初中部 村奥园学校(公立)幼儿园小学初中部,"有地铁,广州华南版块黄 金地段,边成熟",交通配套设施齐，生活方便，餐饮：长隆欢乐世界、香江野生动物世界、长隆水上乐园、长龙高尔夫、万博商业中 心、御水泉国际水疗会、商店：新一佳购物广场、广汇百货、十八哥超市、华润万家超市、宏城超市、沃尔玛山姆会员店、银行：工商银行、建设银行、浦发银行、农业银行都是你生活的邻居,番109路、303A路、10A路、10B路、109B路、番125路、番52路、番75路汉溪长隆公交站总站 地铁3号线汉溪长隆还有即将开通的7号线,1.户型方正，阳台空气流动性强2.最引人人的亮点：视野开阔，华南板块稀有3.可利用性高，性价 比高,
http://gz.lianjia.com/zufang/GZ0002171748.html,56平米,1室2厅1卫  整租,低楼层 (共22层),南,距地铁7号线南村万博445米,敏捷上城商务中心二期2套出租中,番禺华南,112天前发布,整租,暂无数据,暂无数据,暂无数据,业主新装修 复式公寓 客厅宽敞明亮 有独立房间 也可做办公使用。,,,双地铁 交通方便 新装修 家私家电齐,商场超市沃尔玛(海印又一城店)(番禺区迎宾路海印又一城购物(近凯迪拉克专卖店))、正佳超市(南村镇里仁洞新兴大道)、信华购物广场(广州市番禺区)、新一佳(番禺锦绣香江店)(锦绣香江花园紫荆雅园cd栋商业大厦)、杰兴百货商场(南村镇兴业大道247号),交通公交华南碧桂园(129路;302路;303路;987路;番143路;番145路;番146路;番163路;番186路;番190路;番禺70路;公交地铁接驳专线9路;夜88路)、兴业路口(番10路;番186路;番禺70路;公交地铁接驳专线9路)、,,
http://gz.lianjia.com/zufang/GZ0002167192.html,216平米,5室2厅3卫  整租,高楼层 (共33层),北,距地铁5号线动物园408米,润粤大厦3套出租中,越秀水荫,124天前发布,整租,暂无数据,暂无数据,暂无数据,"现有租客办公，保养一般，五房两厅三卫两阳台，厅和卧室都是飘窗，有生活阳台,办公装修,商住两用.",该小区位于环市东路和天河路交间处，地理位置很好，交通很方便，地铁沿线，小区24小时的保安值勤，该小区里面的房子实用率很高，有86%以上，而且间隔也很实用，现在这小区里面的，还有省级东风东小学，南向望环市东路，北向水荫路这边，也比较安静！,,顶层复式 商住两用,广州动物园、东风公园；越秀区圣亚医院、广州解放军第458医院、广空司令部医院、白云区人民医院；天河城、正佳广场、维多利广场、时代广场；华润万家,公交：天河立交站、水荫路站、广州大道中站，地铁：五号线动物园站,,
http://gz.lianjia.com/zufang/GZ0002173436.html,87平米,1室1厅1卫  整租,低楼层 (共16层),西北,距地铁2号线南浦1149米,丽江花园左岸5套出租中,番禺南浦,111天前发布,整租,暂无数据,暂无数据,暂无数据,"装修保养新净,电梯高层，阳台 安静舒适，望美景，家私家电齐，拎包入住",,,精致房源 重新装修 保养很好,学校：丽江公立小学(中学)广州大学城 莱恩中英文学校 洛溪新城学校幼儿园：儿童活动 莱恩中英文幼儿园 私立幼儿园数8间商场：宏城超市 百佳超市 福特玛超市市场：农家菜市场邮局：中国邮政银行：建设银行 中国银行 工商银行医院：丽江花园医务所，大石人民医院,丽江花园坐拥双地铁(2号线南浦站和3号线夏滘站)小区里面数条公交车穿梭(有125路、122路、接驳5号、186路、79路、夜13路等)，直达广州各城区 方便快捷！,,
http://gz.lianjia.com/zufang/GZ0002174305.html,41平米,2室1厅1卫  整租,中楼层 (共8层),南,距地铁3号线大石848米,富丽家园百丰楼3套出租中,番禺大石,111天前发布,整租,暂无数据,暂无数据,暂无数据,房子装修很不错，南向单位 ，房子地处繁华的大使阶段，适合的人群多，而且房子采光好,,,地处繁华阶段 生活很方便,大石城，步行街，大石家私城，民润超市，信和超市，天和百货，人人乐等多个大型超市。,"地铁3号线,1、7、13、17、51、211、247、288、301、305、308、309、512、530、562等等。",,
http://gz.lianjia.com/zufang/GZ0002178518.html,100平米,3室2厅1卫  整租,低楼层 (共11层),东南,距地铁广佛线燕岗1121米,保利花园保康路3套出租中,海珠工业大道中,129天前发布,整租,暂无数据,暂无数据,暂无数据,家私家电齐，而且保养新，房屋整体环境温馨别致，瓷砖墙面干净整洁,小区环境优美，面对工业大道同类楼盘的竞争，开发商力求尽善尽美，从而奠定其在海珠区乃至广州大盘的地位。内设：花园 幼儿园 会所 小亭 泳池 娱乐健身场地等硬件设施。环境清幽舒适 空气清新怡人,保利幼儿园、海富幼儿园、江南大道南幼儿园、保利百合幼儿园、保利花园幼儿园、保利红棉小学、晓园中学、广州市98中学、,保利花园 电梯三房 家私家电齐 拎包入住,医院：广州医学院第二附属医院、口腔医院、珠江医院、石溪中医院、江南外科医院。市场：华润万家超市、百佳超市、保利红棉市场、石溪肉菜市场。银行：中国银行、工商银行、建设银行 农业银行 交通银行,"交通方便保利花园(南石头)-公交车站(521路-527路)地铁广佛线(燕岗)站2号线江泰路站途经公交车：79路, 288a路, 309路, 469路, 521路, 527路 180路 31路 29路 220路 221路 等等",,
http://gz.lianjia.com/zufang/GZ0002176757.html,123平米,3室2厅2卫  整租,高楼层 (共17层),东,距地铁6号线河沙805米,珠岛花园17栋4套出租中,荔湾大坦沙,195天前发布,整租,暂无数据,暂无数据,暂无数据,该房屋保养良好，电梯高层，复式单位，三房两厅两卫，既有江景又有园景，拎包入住。,,,交通便利 望江复式,家乐福超市、万家超市、太佳广场、国昇百货、河沙菜市场、广州酒家、金半岛酒家、人山人海园林酒家,128、256、783、416(环岛线)、坦尾站(5、6号线换乘站)、河沙站(6号线)。,,
http://gz.lianjia.com/zufang/GZ0002183841.html,114平米,3室2厅2卫  整租,高楼层 (共6层),南,暂无数据,绿庭雅苑4套出租中,番禺沙湾,108天前发布,整租,暂无数据,暂无数据,暂无数据,该房子是精装修，业主保养得很好，格局方正，家私电器保养不错。,,小区：会所、幼儿园、运动场所商场：信和超市、明超超市医院：番禺区人民医院、何贤医院银行：中国银行、中国工商银行、中国农业银行、农村信用合作社,精装修  精致三房  家私电齐,,公交车：百越广场站，途径线路包括5路、9路、12路、18路、19路。130地铁站：地铁3号线市桥站。自驾车：新光快速。,,
http://gz.lianjia.com/zufang/GZ0002180861.html,40平米,1室1厅1卫  整租,低楼层 (共36层),东,距地铁5号线淘金443米,保利中环广场9套出租中,越秀建设路,211天前发布,整租,暂无数据,暂无数据,暂无数据,房屋装修是以前交楼靓装修，房子高质量地板砖铺设，乳白色墙面。房屋干净，大房大厅，厅出阳台，采光好。,,有：建设大马路小学、建设六马路小学、环市路小学。广大附中、二十一中、执信中学等。,好地段 交通方便 生活配套,配套：楼下就有吉之岛大型购物超市，各大品牌服装店，保利影院，星巴克，茶餐厅，温祈福酒家等等，齐备。,,,
http://gz.lianjia.com/zufang/GZ0002183670.html,97平米,2室2厅1卫  整租,低楼层 (共36层),东,距地铁5号线淘金443米,保利中环广场9套出租中,越秀建设路,211天前发布,整租,暂无数据,暂无数据,暂无数据,房屋装修是以前交楼，房子地板砖铺设，乳白色墙面。房屋干净，大房大厅，厅出阳台，采光好。,保利中环广场管理，来访人员出入需登记。C座单位3梯7户。六楼带有空中花园，空气环境好，有部分娱乐设施。,,家电齐 拎包入住,配套：楼下就有吉之岛大型购物超市，各大服装店，保利影院，星巴克，茶餐厅，温祈福酒家等等。,,,
http://gz.lianjia.com/zufang/GZ0002183669.html,80平米,2室2厅1卫  整租,中楼层 (共32层),北,距地铁2号线南洲810米,金碧花园第三金碧68套出租中,海珠金碧,204天前发布,整租,暂无数据,暂无数据,暂无数据,本人亲自看过 简单装修 干净整洁  卫生间干湿分离，拎包入住 室内居家精装修，保养干净舒适，客厅装饰显得房子特温馨，采光通风好,"恒大地产开发的，物业为金碧物业，楼间距较大的大型楼盘。社区里面的生活配套很完善，1.小区楼龄(2003年),目前已有12年楼龄2.金碧花园一期属于大型高层住宅小区，小区环境优美，娱乐设施配套完善，",带金碧一小学，对接三幼幼儿园。学校有：金碧一小学，一幼，二幼，三幼，97高中部。,金碧三期 安静望花园 厅直出 温馨两房,银行，力美健健身房 。餐饮娱乐如金碧大世界，ktv， 肯德基，小区门口150米处就是加油站,公交线路(金碧花园门口)：5路·35路·70路·82路·125路·129路·129A路·236路·273路·67路·路·812路·780路·地铁：(1)2号线东晓南站，步行10分路程(C1、C2、A、B、出口) (2)广佛线石溪站，步行仅2分路程，实现广佛同城的理念,,
